{
  "schemaVersion": "1.0.0-draft",
  "mediaType": "application/vnd.agentsuite.agent.v1+json",
  "id": "reviewer",
  "description": "Reviews content requested by the coordinator.",
  "instructions": {
    "path": "instructions/reviewer.md",
    "digest": "sha256:daaf4fc0ea017bdc02e8b66a8bb6d36e062dbf4f0955f64cb47fcbaa953210fe"
  },
  "model": {
    "protocol": "openai-compatible",
    "model": "example-model"
  },
  "tools": [],
  "invokes": [],
  "extensions": []
}
